{"version":"voxa.graph/v1","graph_id":"text-uppercase","nodes":[{"id":"source","node_type":"builtin.text_source","language":"rust","factory_version":"1.0.0","node_config":{"text":"hello"}},{"id":"upper","node_type":"builtin.uppercase","language":"rust","factory_version":"1.0.0","node_config":{}},{"id":"sink","node_type":"builtin.text_sink","language":"rust","factory_version":"1.0.0","node_config":{}}],"edges":[{"id":"source-upper","from":{"node_id":"source","port":"text_out"},"to":{"node_id":"upper","port":"text_in"},"frame_type":"text","queue_policy":{"capacity":32,"overflow":"block"}},{"id":"upper-sink","from":{"node_id":"upper","port":"text_out"},"to":{"node_id":"sink","port":"text_in"},"frame_type":"text","queue_policy":{"capacity":32,"overflow":"block"}}]}
